[
  {
    "id": "es.p.swim_skill",
    "revision": 1,
    "skill_id": "es.modality",
    "family_id": "es.f.swim_skill",
    "level": "A2",
    "difficulty": 2,
    "context": "Вы объясняете, что научились плавать в детстве.",
    "instruction": "Дополните сообщение.",
    "prompt": "___ nadar desde pequeño.",
    "choices": [
      {
        "id": "a",
        "text": "Soy"
      },
      {
        "id": "b",
        "text": "Estoy"
      },
      {
        "id": "c",
        "text": "Sé"
      },
      {
        "id": "d",
        "text": "Conozco"
      }
    ],
    "correct_answer": "c",
    "explanation": "Умение выполнять действие выражается saber + действие: sé nadar.",
    "status": "approved"
  },
  {
    "id": "es.p.no_entry",
    "revision": 1,
    "skill_id": "es.modality",
    "family_id": "es.f.no_entry",
    "level": "A2",
    "difficulty": 3,
    "context": "Вы читаете надпись на двери.",
    "instruction": "Что означает надпись?",
    "prompt": "No se puede entrar",
    "choices": [
      {
        "id": "a",
        "text": "Вход открыт всегда."
      },
      {
        "id": "b",
        "text": "Нужно войти немедленно."
      },
      {
        "id": "c",
        "text": "Вход уже закрывали вчера."
      },
      {
        "id": "d",
        "text": "Вход запрещён."
      }
    ],
    "correct_answer": "d",
    "explanation": "No se puede сообщает о запрете или отсутствии разрешения.",
    "status": "approved"
  },
  {
    "id": "es.p.must_leave",
    "revision": 1,
    "skill_id": "es.modality",
    "family_id": "es.f.must_leave",
    "level": "A2",
    "difficulty": 1,
    "context": "Чтобы успеть на поезд, вам обязательно нужно уйти сейчас.",
    "instruction": "Дополните сообщение.",
    "prompt": "Tengo ___ salir ahora.",
    "choices": [
      {
        "id": "a",
        "text": "que"
      },
      {
        "id": "b",
        "text": "de"
      },
      {
        "id": "c",
        "text": "a"
      },
      {
        "id": "d",
        "text": "por"
      }
    ],
    "correct_answer": "a",
    "explanation": "Обязанность или необходимость выражается tener que.",
    "status": "approved"
  },
  {
    "id": "es.p.general_rule",
    "revision": 1,
    "skill_id": "es.modality",
    "family_id": "es.f.general_rule",
    "level": "A2",
    "difficulty": 1,
    "context": "Вы напоминаете об общем правиле: перед едой нужно мыть руки.",
    "instruction": "Дополните сообщение.",
    "prompt": "___ lavarse las manos antes de comer.",
    "choices": [
      {
        "id": "a",
        "text": "Tiene de"
      },
      {
        "id": "b",
        "text": "Hay que"
      },
      {
        "id": "c",
        "text": "Hay de"
      },
      {
        "id": "d",
        "text": "Es que de"
      }
    ],
    "correct_answer": "b",
    "explanation": "Hay que выражает общую необходимость без конкретного исполнителя.",
    "status": "approved"
  },
  {
    "id": "es.p.permission_photo",
    "revision": 1,
    "skill_id": "es.modality",
    "family_id": "es.f.permission_photo",
    "level": "A2",
    "difficulty": 2,
    "context": "В музее вы спрашиваете разрешение фотографировать.",
    "instruction": "Дополните сообщение.",
    "prompt": "¿Se ___ hacer fotos aquí?",
    "choices": [
      {
        "id": "a",
        "text": "conoce"
      },
      {
        "id": "b",
        "text": "es"
      },
      {
        "id": "c",
        "text": "puede"
      },
      {
        "id": "d",
        "text": "sabe"
      }
    ],
    "correct_answer": "c",
    "explanation": "Se puede спрашивает, разрешено ли действие.",
    "status": "approved"
  },
  {
    "id": "es.p.want_rest",
    "revision": 1,
    "skill_id": "es.modality",
    "family_id": "es.f.want_rest",
    "level": "A2",
    "difficulty": 1,
    "context": "Друг предлагает продолжить прогулку, но вы хотите отдохнуть.",
    "instruction": "Дополните сообщение.",
    "prompt": "Quiero ___ un poco.",
    "choices": [
      {
        "id": "a",
        "text": "descanso"
      },
      {
        "id": "b",
        "text": "descansando"
      },
      {
        "id": "c",
        "text": "descansado"
      },
      {
        "id": "d",
        "text": "descansar"
      }
    ],
    "correct_answer": "d",
    "explanation": "После quiero другое действие ставится в исходной форме descansar.",
    "status": "approved"
  },
  {
    "id": "es.p.computer_skill",
    "revision": 1,
    "skill_id": "es.modality",
    "family_id": "es.f.computer_skill",
    "level": "A2",
    "difficulty": 2,
    "context": "В анкете вы сообщаете, что умеете пользоваться этой программой.",
    "instruction": "Дополните сообщение.",
    "prompt": "___ usar este programa.",
    "choices": [
      {
        "id": "a",
        "text": "Sé"
      },
      {
        "id": "b",
        "text": "Conozco a"
      },
      {
        "id": "c",
        "text": "Estoy"
      },
      {
        "id": "d",
        "text": "Soy"
      }
    ],
    "correct_answer": "a",
    "explanation": "Для навыка «умею пользоваться» нужно sé usar.",
    "status": "approved"
  },
  {
    "id": "es.p.appointment_obligation",
    "revision": 1,
    "skill_id": "es.modality",
    "family_id": "es.f.appointment_obligation",
    "level": "A2",
    "difficulty": 3,
    "context": "Врач даёт пациенту указание.",
    "instruction": "Что должен сделать пациент?",
    "prompt": "Tiene que volver el lunes",
    "choices": [
      {
        "id": "a",
        "text": "Позвонить в любой день."
      },
      {
        "id": "b",
        "text": "Вернуться в понедельник."
      },
      {
        "id": "c",
        "text": "Вернуться только по желанию."
      },
      {
        "id": "d",
        "text": "Никогда больше не возвращаться."
      }
    ],
    "correct_answer": "b",
    "explanation": "Tiene que выражает необходимость вернуться в названный день.",
    "status": "approved"
  },
  {
    "id": "es.p.no_park_sign",
    "revision": 1,
    "skill_id": "es.modality",
    "family_id": "es.f.no_park_sign",
    "level": "A2",
    "difficulty": 2,
    "context": "Вы переводите правило парковки у ворот.",
    "instruction": "Дополните сообщение.",
    "prompt": "Está prohibido ___.",
    "choices": [
      {
        "id": "a",
        "text": "aparcando"
      },
      {
        "id": "b",
        "text": "aparcado"
      },
      {
        "id": "c",
        "text": "aparcar"
      },
      {
        "id": "d",
        "text": "aparca"
      }
    ],
    "correct_answer": "c",
    "explanation": "После está prohibido действие называют формой aparcar.",
    "status": "approved"
  },
  {
    "id": "es.p.cannot_tonight",
    "revision": 1,
    "skill_id": "es.modality",
    "family_id": "es.f.cannot_tonight",
    "level": "A2",
    "difficulty": 3,
    "context": "Друг отвечает на приглашение.",
    "instruction": "Что сообщает друг?",
    "prompt": "Quiero ir, pero no puedo",
    "choices": [
      {
        "id": "a",
        "text": "Он может пойти, но не хочет."
      },
      {
        "id": "b",
        "text": "Он уже сходил."
      },
      {
        "id": "c",
        "text": "Он не знает, куда идти."
      },
      {
        "id": "d",
        "text": "Он хочет пойти, но не может."
      }
    ],
    "correct_answer": "d",
    "explanation": "Quiero выражает желание, no puedo — невозможность.",
    "status": "approved"
  }
]
