[
  {
    "id": "es.p.think_trip",
    "revision": 1,
    "skill_id": "es.patterns",
    "family_id": "es.f.think_trip",
    "level": "B1",
    "difficulty": 1,
    "context": "Вы часто думаете о предстоящей поездке.",
    "instruction": "Дополните сообщение.",
    "prompt": "Pienso mucho ___ el viaje.",
    "choices": [
      {
        "id": "a",
        "text": "de"
      },
      {
        "id": "b",
        "text": "a"
      },
      {
        "id": "c",
        "text": "con"
      },
      {
        "id": "d",
        "text": "en"
      }
    ],
    "correct_answer": "d",
    "explanation": "В значении «думать о» используется pensar en.",
    "status": "approved"
  },
  {
    "id": "es.p.depend_weather",
    "revision": 1,
    "skill_id": "es.patterns",
    "family_id": "es.f.depend_weather",
    "level": "B1",
    "difficulty": 1,
    "context": "Решение о пикнике зависит от погоды.",
    "instruction": "Дополните сообщение.",
    "prompt": "El picnic depende ___ tiempo.",
    "choices": [
      {
        "id": "a",
        "text": "del"
      },
      {
        "id": "b",
        "text": "al"
      },
      {
        "id": "c",
        "text": "en el"
      },
      {
        "id": "d",
        "text": "con el"
      }
    ],
    "correct_answer": "a",
    "explanation": "Depender сочетается с de; de + el даёт del.",
    "status": "approved"
  },
  {
    "id": "es.p.count_help",
    "revision": 1,
    "skill_id": "es.patterns",
    "family_id": "es.f.count_help",
    "level": "B1",
    "difficulty": 1,
    "context": "Вы говорите другу, что он может рассчитывать на вашу помощь.",
    "instruction": "Дополните сообщение.",
    "prompt": "Puedes contar ___ mi ayuda.",
    "choices": [
      {
        "id": "a",
        "text": "por"
      },
      {
        "id": "b",
        "text": "con"
      },
      {
        "id": "c",
        "text": "de"
      },
      {
        "id": "d",
        "text": "a"
      }
    ],
    "correct_answer": "b",
    "explanation": "Contar con означает «рассчитывать на».",
    "status": "approved"
  },
  {
    "id": "es.p.happy_result",
    "revision": 1,
    "skill_id": "es.patterns",
    "family_id": "es.f.happy_result",
    "level": "B1",
    "difficulty": 2,
    "context": "Команда довольна результатом матча.",
    "instruction": "Дополните сообщение.",
    "prompt": "Estamos contentos ___ el resultado.",
    "choices": [
      {
        "id": "a",
        "text": "hasta"
      },
      {
        "id": "b",
        "text": "para"
      },
      {
        "id": "c",
        "text": "con"
      },
      {
        "id": "d",
        "text": "hacia"
      }
    ],
    "correct_answer": "c",
    "explanation": "Довольство конкретным результатом выражается contentos con.",
    "status": "approved"
  },
  {
    "id": "es.p.full_people",
    "revision": 1,
    "skill_id": "es.patterns",
    "family_id": "es.f.full_people",
    "level": "B1",
    "difficulty": 2,
    "context": "Вы описываете заполненный людьми зал.",
    "instruction": "Дополните сообщение.",
    "prompt": "La sala está llena ___ gente.",
    "choices": [
      {
        "id": "a",
        "text": "hacia"
      },
      {
        "id": "b",
        "text": "para"
      },
      {
        "id": "c",
        "text": "hasta"
      },
      {
        "id": "d",
        "text": "de"
      }
    ],
    "correct_answer": "d",
    "explanation": "Lleno de означает «полный чего-либо».",
    "status": "approved"
  },
  {
    "id": "es.p.looks_like",
    "revision": 1,
    "skill_id": "es.patterns",
    "family_id": "es.f.looks_like",
    "level": "B1",
    "difficulty": 3,
    "context": "Вы замечаете, что ребёнок похож на отца.",
    "instruction": "Дополните сообщение.",
    "prompt": "Se parece ___ su padre.",
    "choices": [
      {
        "id": "a",
        "text": "a"
      },
      {
        "id": "b",
        "text": "de"
      },
      {
        "id": "c",
        "text": "en"
      },
      {
        "id": "d",
        "text": "por"
      }
    ],
    "correct_answer": "a",
    "explanation": "Parecerse a обозначает сходство с кем-либо.",
    "status": "approved"
  },
  {
    "id": "es.p.dream_house",
    "revision": 1,
    "skill_id": "es.patterns",
    "family_id": "es.f.dream_house",
    "level": "B1",
    "difficulty": 2,
    "context": "Вы рассказываете о мечте жить у моря.",
    "instruction": "Дополните сообщение.",
    "prompt": "Sueño ___ una casa junto al mar.",
    "choices": [
      {
        "id": "a",
        "text": "para"
      },
      {
        "id": "b",
        "text": "con"
      },
      {
        "id": "c",
        "text": "a"
      },
      {
        "id": "d",
        "text": "en"
      }
    ],
    "correct_answer": "b",
    "explanation": "В значении «мечтать о» используется soñar con.",
    "status": "approved"
  },
  {
    "id": "es.p.interested_history",
    "revision": 1,
    "skill_id": "es.patterns",
    "family_id": "es.f.interested_history",
    "level": "B1",
    "difficulty": 3,
    "context": "Собеседник сообщает об интересе к истории.",
    "instruction": "Дополните сообщение.",
    "prompt": "Estoy interesado ___ la historia de la ciudad.",
    "choices": [
      {
        "id": "a",
        "text": "hasta"
      },
      {
        "id": "b",
        "text": "sin"
      },
      {
        "id": "c",
        "text": "en"
      },
      {
        "id": "d",
        "text": "hacia"
      }
    ],
    "correct_answer": "c",
    "explanation": "Interesado en связывает интерес с его темой.",
    "status": "approved"
  },
  {
    "id": "es.p.remember_appointment",
    "revision": 1,
    "skill_id": "es.patterns",
    "family_id": "es.f.remember_appointment",
    "level": "B1",
    "difficulty": 3,
    "context": "Вы напоминаете другу о встрече.",
    "instruction": "Дополните сообщение.",
    "prompt": "Acuérdate ___ la cita.",
    "choices": [
      {
        "id": "a",
        "text": "en"
      },
      {
        "id": "b",
        "text": "a"
      },
      {
        "id": "c",
        "text": "con"
      },
      {
        "id": "d",
        "text": "de"
      }
    ],
    "correct_answer": "d",
    "explanation": "Acordarse сочетается с de.",
    "status": "approved"
  },
  {
    "id": "es.p.agree_proposal",
    "revision": 1,
    "skill_id": "es.patterns",
    "family_id": "es.f.agree_proposal",
    "level": "B1",
    "difficulty": 2,
    "context": "Вы поддерживаете предложение коллеги.",
    "instruction": "Дополните сообщение.",
    "prompt": "Estoy de acuerdo ___ tu propuesta.",
    "choices": [
      {
        "id": "a",
        "text": "con"
      },
      {
        "id": "b",
        "text": "hasta"
      },
      {
        "id": "c",
        "text": "hacia"
      },
      {
        "id": "d",
        "text": "sin"
      }
    ],
    "correct_answer": "a",
    "explanation": "Согласие с предложением выражается de acuerdo con.",
    "status": "approved"
  }
]
